<?xml version="1.0" encoding="UTF-8"?>
<marcadores xmlns:xsi="http://www.w3.org/2001/XMLSchema-instance"
    xsi:noNamespaceSchemaLocation="01-marcadoresmodular.xsd">
	 <pagina>
		 <nombre edad='3'>Xataka</nombre>
		 <descripcion>Noticias sobre tecnología.</descripcion>
		 <url>https://www.xataka.com/</url>
	 </pagina>
	 <pagina>
		 <nombre>Wikipedia</nombre>
		 <descripcion>La enciclopedia libre.</descripcion>
		 <url>http://www.wikipedia.org/</url>
	 </pagina>
	 <pagina>
	 
		 <nombre>W3C</nombre>
		 <descripcion>World Wide Web Consortium.</descripcion>
		 
		 <url>http://www.w3.org/</url>
	 </pagina>
</marcadores>